{
  "slug": "eurocrate-storage-system",
  "type": "project",
  "title": "Eurocrate storage system",
  "summary": "Reusable project entity for the 600x400 modular eurocontainer storage system, shared between the project page, project board, and Cosmoboard.",
  "status": "active",
  "projectSlug": "eurocrate-storage-universal-solution",
  "tags": ["project", "storage", "workspace"],
  "references": [
    {
      "surface": "project",
      "slug": "eurocrate-storage-universal-solution",
      "path": "content/projects/eurocrate-storage-universal-solution.html"
    },
    {
      "surface": "board",
      "slug": "eurocrate-storage",
      "path": "content/boards/projects/eurocrate-storage/current.canvas"
    },
    {
      "surface": "board",
      "slug": "cosmoboard",
      "path": "content/boards/cosmoboard/current.canvas"
    }
  ]
}
